{
  "ts": "2026-07-10T22:01:00.000Z",
  "v": 1,
  "type": "task_done",
  "source": "target",
  "from": "claude:sess-abc123",
  "model": "claude-sonnet-5",
  "node": "prj-0001",
  "task": "2.1",
  "run": "tgt-prj-0001-claude-g1",
  "outcome": "SUCCESS",
  "data": { "commit": "abc1234", "concerns": 0 }
}
