{
  "ts": "2026-07-10T22:00:00.000Z",
  "v": 1,
  "type": "task_started",
  "source": "target",
  "from": "claude:sess-abc123",
  "model": "claude-sonnet-5",
  "host": "mbp16",
  "project": "example",
  "node": "prj-0001",
  "task": "2.1",
  "run": "tgt-prj-0001-claude-g1",
  "data": { "title": "add the widget", "executor": "do" }
}
